link,headline,category,short_description,authors,date
link,headline,MEDIA,authors,date
https://www.huffingtonpost.com/entry/return-of-the-rudeboy-exhibition_n_5978672.html,Fly Rudeboys Reminds Us What Cool Looks Like,BLACK VOICES,Jessica Dickerson,2014-10-16
https://www.huffingtonpost.com/entry/anthony-hamilton-biggest-way-black-people-effect-change_us_57e59044e4b08d73b83158b6,Anthony Hamilton On The Biggest Way Black People Can Help Effect Change,BLACK VOICES,Brennan Williams,2016-09-26
https://www.huffingtonpost.com/entry/funeral-to-be-held-for-ma_n_7045664.html,Hundreds Gather For Walter Scott's Funeral,BLACK VOICES,,2015-04-11
https://www.huffingtonpost.comhttp://www.theroot.com/articles/culture/2016/01/her_name_was_janese_talton_jackson_and_she_was_killed_because_she_said_no.html,Her Name Was Janese Talton-Jackson And She Was Killed Because She Said No,BLACK VOICES,,2016-01-26
https://www.huffingtonpost.comhttp://www.theroot.com/blogs/the_grapevine/2016/01/vh1_soul_is_now_bet_soul_will_offer_original_programming.html,"VH1 Soul Is Now BET Soul, Will Offer Original Programming",BLACK VOICES,,2016-01-07
https://www.huffingtonpost.comhttp://blogs.indiewire.com/shadowandact/marvel-salutes-hip-hop-w-50-variant-covers-paying-homage-to-classic-albums-covers-20150714,Marvel Salutes Hip-Hop With 50 Variant Covers Paying Homage to Classic Albums Covers,BLACK VOICES,,2015-07-15
https://www.huffingtonpost.com/entry/black-news-2014_n_6401456.html,"#BlackLivesMatter Truly Dominated 2014",BLACK VOICES,Rahel Gebreyes,2014-12-31
https://www.huffingtonpost.com/entry/sandra-blands-funeral-draws-hundreds-of-mourners_us_55b3e01de4b0074ba5a4c844,Sandra Bland's Funeral Draws Hundreds Of Mourners,BLACK VOICES,,2015-07-25
https://www.huffingtonpost.com/entry/david-oyelowo-theres-too-many-african-stories-with-white-saviors_us_56b23cb8e4b01d80b244be64,David Oyelowo: There's Too Many African Stories With 'White Saviors',BLACK VOICES,Brennan Williams,2016-02-03
https://www.huffingtonpost.com/entry/john-legend-clears-up-some-confusion-for-trump-jr-your-father-is-racist_us_56e6c408e4b0860f99d97ffb,John Legend Clears Up Some Confusion For Trump Jr.: Your Father Is Racist,BLACK VOICES,Taryn Finley,2016-03-14
https://www.huffingtonpost.com/entry/young-dolph-gives-20k-to-baristas-fired-for-playing-his-song-get-paid-in-shop_us_5af98995e4b032b10bfce3c0,"Young Dolph Gives $20,000 To Baristas Fired For Playing His Song 'Get Paid'",BLACK VOICES,Jenna Amatulli,2018-05-14
https://www.huffingtonpost.comhttp://www.newyork.com/articles/broadway/10-things-you-may-not-know-about-me-james-monroe-iglehart-of-aladdin-58134/,Acclaimed 'Aladdin' Star James Monroe Iglehart Talks About Life Beyond The Tony Awards,BLACK VOICES,,2016-06-09
https://www.huffingtonpost.com/entry/white-teen-harassed-black-student_us_58bec47ee4b09ab537d6c407,White Teen Calls Student 'Black Piece Of S**t' In Disturbing Video,BLACK VOICES,Taryn Finley,2017-03-07
https://www.huffpost.com/entry/megan-thee-stallion-savage-challenge_n_5e7a7477c5b6d01bd153a5a7,The Megan Thee Stallion-Approved ‘Savage' Challenge Is Helping Keep Us All Sane,BLACK VOICES,Taryn Finley,2020-03-25
https://www.huffingtonpost.com/entry/naomi-campbell-white-dress-weeks-best-style-moments_us_5badf0cee4b0bb1705fb94fa,Naomi Campbell Rocks White After Labor Day & More Of The Week's Best Style Moments (PHOTOS),BLACK VOICES,Julee Wilson,2013-09-29
https://www.huffingtonpost.com/entry/bill-hader-hosting-snl-saturday-night-live_n_5836756.html,This Episode Of 'SNL' Will Have EVERYTHING,COMEDY,Carol Hartsell,2014-09-17
https://www.huffingtonpost.com/entry/trevor-noah-and-comedian-neal-brennan-have-solved-the-gun-control-debate_us_59db9bc9e4b00377980aaa60,Trevor Noah And Comedian Neal Brennan Figure Out How To End The Gun Control Debate,COMEDY,Andy McDonald,2017-10-09
https://www.huffingtonpost.com/entry/the-daily-szep-tampa_us_5bad0613e4b04234e855e722,The Daily Szep: Tampa,COMEDY,"Paul Szep, Contributor
Two-time Pulitzer Prize-winning cartoonist",2012-08-25
https://www.huffpost.com/entry/alec-bladwin-sees-black-trump-in-kanye-on-snl_n_5bc2b9e0e4b0bd9ed55abc56,Alec Baldwin Embraces His 'Black Trump' In Crazed 'SNL' Meeting With Kanye West,COMEDY,Mary Papenfuss,2018-10-14
https://www.huffingtonpost.com/entry/electric-fence-experiment_us_5bad1a41e4b04234e856be1d,Electric Fence Experiment Ends As Expected (VIDEO),COMEDY,,2013-03-09
https://www.huffingtonpost.com/entry/election-night-drink-recipes-to-get-you-blackout-after-you-vote_us_5820a9bde4b0aac62485bdf2,It's Over! Election Night Drink Recipes To Erase This Entire Election Cycle,COMEDY,John Trowbridge,2016-11-08
https://www.huffingtonpost.com/entry/jimmy-kimmel-donald-trump-plan-of-action_us_588322e5e4b0e3a735692c72,Jimmy Kimmel Vows To Grab ‘Pumpkin’ President Donald Trump 'By The Guts' For The Next 4 Years,COMEDY,Lee Moran,2017-01-21
https://www.huffingtonpost.com/entry/jimmy-fallon-thank-you-notes_us_5bacfd22e4b04234e85558f7,"Jimmy Fallon's Thank You Notes For Parents, Tiger Woods & The GOP Race (VIDEO)",COMEDY,,2012-03-31
https://www.huffingtonpost.com/entry/awkward-third-wheel-buzzfeed_n_5882898.html,Anyone Who's Been The Third Wheel Will Understand This,COMEDY,Sarah Barness,2014-09-25
https://www.huffingtonpost.com/entry/bill-maher-democrats-overregulation_us_59d877fae4b072637c443882,Bill Maher Issues Strong Words To Democrats About Over-Regulation,COMEDY,Lee Moran,2017-10-07
https://www.huffingtonpost.com/entry/nanobreweries-above-average_us_55ddd877e4b08cd3359e128e,Nanobrews Take The Nation (And Beer Snobs' Money) By Tiny Storm,COMEDY,Andy McDonald,2015-08-26
https://www.huffingtonpost.com/entry/james-corden-recaps-january-2018_us_5a72cf3ae4b06fa61b4d7e13,James Corden's Double-Quick Recap Of January 2018 Is Exhausting Just To Watch,COMEDY,Lee Moran,2018-02-01
https://www.huffingtonpost.com/entry/bad-lip-reading-mayweather-mcgregor-viral-video_us_5969b432e4b03389bb17913f,Bad Lip Reading Of Trash-Talkers Floyd Mayweather And Conor McGregor Gets Brutal,COMEDY,Lee Moran,2017-07-15
https://www.huffingtonpost.com/entry/bill-maher-fear-isis-monsanto_n_5857344.html,'United States Of Pants-Shitters',COMEDY,Carol Hartsell,2014-09-21
https://www.huffingtonpost.com/entry/stephen-colbert-canada-donald-trump_us_5809be4de4b0cdea3d86ad4a,Stephen Colbert Plots A Post-Election Escape Route To Canada,COMEDY,Lee Moran,2016-10-21
https://www.huffpost.com/entry/lori-vallow-brother-alex-cox-cause-of-death_n_5eb81493c5b6792f3f8ae786,Brother Of ‘Doomsday’ Mom Lori Vallow Died Of Natural Causes: Autopsy,CRIME,Nina Golgowski,2020-05-10
https://www.huffingtonpost.com/entry/ohio-deputy-allegedly-shoots-neighbor_us_5665e66ce4b072e9d1c7047f,Deputy Already Under Investigation For A Shooting Allegedly Shoots Neighbor,CRIME,Michael McLaughlin,2015-12-07
https://www.huffingtonpost.com/entry/draven-rodriguez-laser-cat-yearbook-dies-dead_n_6727548.html,Teen Behind Laser Cat Yearbook Photo Dies,CRIME,Ryan Grenoble,2015-02-21
https://www.huffingtonpost.com/entry/officer-hit-by-car_us_59831ecce4b00f0084ae39da,"Video Shows Texas Police Officer Being Struck By A Car, Flung Into The Air",CRIME,Nina Golgowski,2017-08-03
https://www.huffingtonpost.com/entry/muslim-woman-burned-new-york_us_57d76356e4b09d7a687f6f5c,NYPD: Muslim Woman Set On Fire Just Before 9/11 Anniversary,CRIME,Ed Mazza,2016-09-13
https://www.huffingtonpost.com/entry/kentucky-prayer-patrols_us_5930d0e0e4b0c242ca229321,Kentucky Governor's Crime Plan: Volunteer 'Prayer Patrols' Roaming The Streets,CRIME,Ed Mazza,2017-06-02
https://www.huffingtonpost.com/entry/wife-vanishes-cruise_us_58b14326e4b0780bac29b996,Tech Consultant Arrested For Murder After Wife Vanishes During Cruise,CRIME,Mary Papenfuss,2017-02-25
https://www.huffingtonpost.com/entry/heather-heyer-charlottesville-victim_us_59902e7ee4b09071f69a41c0,"Heather Heyer 'Murdered While Protesting Against Hate' In Charlottesville, Friends Say",CRIME,Dominique Mosbergen and Andy Campbell,2017-08-13
https://www.huffingtonpost.com/entry/ashlee-martinson-kills-parents_n_6846820.html,Grisly Details Emerge In Case Of Teen Accused Of Killing Parents,CRIME,Andres Jauregui,2015-03-11
https://www.huffingtonpost.com/entry/nicole-houde_us_5ba2bbd1e4b0c2784da53467,"Nicole Houde, Former Miss New Hampshire, Arrested After Alleged Assault (PHOTOS)",CRIME,,2012-04-29
https://www.huffingtonpost.com/entry/lax-evacuations_us_57c3b529e4b085c1ff29ff3f,"'Loud Noises,' Mistaken For Gunfire, Cause Panic At LAX",CRIME,Nick Visser,2016-08-29
https://www.huffingtonpost.com/entry/nypd-police-shooting_us_580706a1e4b0b994d4c28fdd,"NYPD Officer Shoots Woman Who Tried To Attack Him With Baseball Bat, Police Say",CRIME,,2016-10-19
https://www.huffingtonpost.com/entry/tracey-lee-giffin-beer-stabbing_us_57bf38dae4b02673444f1037,Woman Stabs Husband With Scissors After He Drinks Her Beer: Police,CRIME,David Moye,2016-08-25
https://www.huffingtonpost.com/entry/david-tapia-attacks-girlfriend-pet-raccoon_n_5648101.html,"Man Throws Girlfriend, Her Pet Raccoon Against Wall: Cops",CRIME,Hilary Hanson,2014-08-04
https://www.huffingtonpost.com/entry/dog-attacks-gas-station-robber_n_6692646.html,WATCH: Dog Attacks Would-Be Gas Station Robber,CRIME,Simon McCormack,2015-02-16
https://www.huffingtonpost.com/entry/bolshoi-ballet-drama-a-whos-who-of-everyone-involved_us_5bb24ce5e4b0171db69f0f5d,A Who's Who Explanation Of Everyone Involved In Bolshoi Ballet Acid Attack,CULTURE & ARTS,Katherine Brooks,2013-03-09
https://www.huffingtonpost.com/entry/city-on-fire_us_5bb25cd1e4b0171db69f8739,City on Fire,CULTURE & ARTS,"George Heymont, Contributor
San Francisco-based arts critic",2013-06-15
https://www.huffingtonpost.com/entry/lets-get-ready-to-rumble_us_5bb26e57e4b0171db6a0b1d5,Let's Get Ready to Rumble!,CULTURE & ARTS,"George Heymont, Contributor
San Francisco-based arts critic",2014-04-12
https://www.huffingtonpost.com/entry/infrared-photos_us_5bb268c6e4b0171db6a04141,Infrared Photos Transform Nepalese Landscape Into Psychedelic Wonderland,CULTURE & ARTS,,2013-12-14
https://www.huffingtonpost.com/entry/jennie-ottinger_us_5bb22690e4b0171db69dd53a,Jennie Ottinger's 'What To Do With Your Orphan: A Manual' At Johansson Projects (PHOTOS),CULTURE & ARTS,Priscilla Frank,2012-05-05
https://www.huffingtonpost.com/entry/in-pursuit-of-magnificent_us_5bb26cc3e4b0171db6a09d2e,In Pursuit of Magnificent Obsessions,CULTURE & ARTS,"George Heymont, Contributor
San Francisco-based arts critic",2014-03-22
https://www.huffingtonpost.com/entry/portland-institute-for-contemporary-art_us_5bb26502e4b0171db69fcc21,Anna Craycroft: On Being Understood,CULTURE & ARTS,"MutualArt, Contributor
World's largest online art information service",2013-08-24
https://www.huffingtonpost.com/entry/trunchball_us_5bb2566ae4b0171db69f4f92,Describing Matilda's Miss Trunchbull,CULTURE & ARTS,"Cara Joy David, Contributor
New York-based entertainment journalist",2013-04-27
https://www.huffingtonpost.com/entry/theatre-of-the-auto-immun_us_5bb2649be4b0171db69fc01d,Theatre of the Auto-Immune System,CULTURE & ARTS,"George Heymont, Contributor
San Francisco-based arts critic",2013-08-11
https://www.huffingtonpost.com/entry/child-prodigies-2013_us_5bb268dfe4b0171db6a047cc,The 12 Most Talented And Tiny Child Prodigies Of 2013,CULTURE & ARTS,,2013-12-22
https://www.huffingtonpost.com/entry/dubai-international-film-festival_us_5bb2417ce4b0171db69ec205,Beyond Hollywood: A Year End Review of Arab Cinema from Dubai,CULTURE & ARTS,"E. Nina Rothe, Contributor
Cultural Activist",2012-12-29
https://www.huffingtonpost.com/entry/sister-corita-kent-retros_us_5bb26b80e4b0171db6a08892,Sister Corita Kent Retrospective in Berlin (VIDEO),CULTURE & ARTS,"Heinrich Schmidt, Contributor
Founder and Director, VernissageTV",2014-03-01
https://www.huffingtonpost.com/entry/wooden-skscraper_us_5bb268cae4b0171db6a042b1,Giant Wooden Skyscraper Wins International Architecture Competition,CULTURE & ARTS,Katherine Brooks,2013-12-14
https://www.huffingtonpost.com/entry/in-memoriam-sadegh-tirafk_us_5bb25ab8e4b0171db69f720e,In Memoriam: Sadegh Tirafkan (1965-2013),CULTURE & ARTS,"John Seed, Contributor
Professor of Art History",2013-05-27
https://www.huffingtonpost.com/entry/odcs-electrifying-boulder_us_5bb26cc3e4b0171db6a09d40,ODC's Electrifying boulders and bones,CULTURE & ARTS,"Carla Escoda, Contributor
Dance, theatre, and arts critic, based in San Francisco.",2014-03-22
https://www.huffingtonpost.com/entry/christmas-tree-tips-decorations_us_5b9ca5e7e4b03a1dcc808bc9,Christmas Tree Tips: How to Make Your Decorations Rock,HOME & LIVING,"GDS, Contributor
Owner",2012-12-20
https://www.huffingtonpost.com/entry/jordan-hembrough-travel-channel-toy-hunter_us_5b9c9b59e4b03a1dcc803f6c,"Jordan Hembrough, Travel Channel's 'Toy Hunter,' Reveals If Your Vintage Toys Are Worth Anything (VIDEO, PHOTOS)",HOME & LIVING,Michelle Manetti,2012-12-11
https://www.huffingtonpost.com/entry/ols-house-germany_us_5b9d3bc4e4b03a1dcc85c1f9,"OLS House In Stuttgart, Germany Is As Unconventional As They Come (PHOTOS)",HOME & LIVING,Michelle Manetti,2013-06-06
https://www.huffingtonpost.com/entry/target-kid-made-modern-todd-oldham_us_5b9bb00be4b03a1dcc79988b,Two Adorable Kids Review Target's 'Kid Made Modern' Collection By Todd Oldham,HOME & LIVING,Dickson Wong,2012-05-09
https://www.huffingtonpost.com/entry/reduce-dust-in-your-home_us_5b9cd947e4b03a1dcc82684e,Reduce Dust In Your Home By Giving Your Stuff A Good Shake,HOME & LIVING,Michelle Manetti,2013-02-24
https://www.huffingtonpost.com/entry/happier-home-new-year_us_5b9caff4e4b03a1dcc80e226,7 Ways To Make Your Home Happier And More Relaxing In The New Year,HOME & LIVING,"Sally Augustin, Contributor
Applied environmental psychologist and principal at Design Wit...",2013-01-07
https://www.huffingtonpost.com/entry/homemade-gift-ideas-monogrammed-mugs_us_5b9c93c3e4b03a1dcc7ff8e7,Homemade Gift Ideas: Monogrammed Mugs,HOME & LIVING,Amy Marturana,2012-12-04
https://www.huffingtonpost.comhttp://www.gardenista.com/posts/special-plants-nursery,"Where To Find The Next ""It"" Plants",HOME & LIVING,,2013-08-05
https://www.huffpost.com/entry/ted-lasso-gifts-jersey-merchandise_l_61238d80e4b0e5b5d8ebf50a,What To Buy The 'Ted Lasso' Fan In Your Life,HOME & LIVING,Janie Campbell,2021-08-23
https://www.huffingtonpost.com/entry/michael-davis-architect-fish-and-game_us_5b9cf7d0e4b03a1dcc835c32,Michael Davis: The Architecture of Memory & Ambiance In The Forging Of The 'Fish & Game' Restaurant (PHOTOS),HOME & LIVING,"Michael Davis, Contributor
Award-winning architect and interior designer",2013-03-26
https://www.huffingtonpost.com/entry/challen-cates-home_us_5b9ca82ce4b03a1dcc809d13,A Look Inside Challen Cates' Chic And Comfortable Family Home,HOME & LIVING,Shana Ecker,2012-12-21
https://www.huffingtonpost.com/entry/replace-a-broken-sprinkler_us_5b9b6712e4b03a1dcc774348,Replace a Broken Sprinkler,HOME & LIVING,"Eric Stromer, Contributor
Host, Over Your Head",2012-03-02
https://www.huffingtonpost.com/entry/most-expensive-homes-photos_us_5b9d18b4e4b03a1dcc846b18,10 Of America's Most Expensive Homes Worth Over $100 Million (PHOTOS),HOME & LIVING,Shana Ecker,2013-04-26
https://www.huffingtonpost.com/entry/dwell-magazine-now-99_us_5b9baaa5e4b03a1dcc797098,Dwell Magazine's 'Now99' May 2012 Issue Spotlights Innovations Influencing Design (PHOTOS),HOME & LIVING,Dickson Wong,2012-05-05
https://www.huffingtonpost.comhttp://www.elizabethstreet.com/living/garage-sale?section=home,Clean House & Give Back With A Garage Sale,HOME & LIVING,,2013-09-14
https://www.huffingtonpost.com/entry/latina-journalist-breaks-down-why-saying-illegals-is-wrong-on-so-many-levels_us_5817347de4b0990edc32026e,Latina Journalist Breaks Down Why Saying 'Illegals' Is Wrong On So Many Levels,LATINO VOICES,Carolina Moreno,2016-10-31
https://www.huffingtonpost.com/entry/harrowing-video-captures-teen-sobbing-as-ice-arrests-her-dad-on-the-way-to-school_us_58b98804e4b0b9989416eb2b,Harrowing Video Captures Teen Sobbing As ICE Arrests Her Dad On The Way To School,LATINO VOICES,Carolina Moreno,2017-03-03
https://www.huffingtonpost.com/entry/missing-students-mexico_n_6321866.html,Damning Report Claims Mexican Federal Police Participated In Disappearance Of 43 Students,LATINO VOICES,Roque Planas and Carolina Moreno,2014-12-14
https://www.huffingtonpost.com/entry/jlo-jennifer-lopez-poem-nina-mariah-donovan_us_5a37e8a2e4b0ff955ad50e59,"J.Lo Is More Than Her Booty, And This Poet Wants To Set The Record Straight",LATINO VOICES,Carolina Moreno,2017-12-18
https://www.huffingtonpost.com/entry/npr-butchers-pronunciation-of-mi-gente-and-twitter-responds-accordingly_us_59ce6c51e4b09538b50804ae,NPR Butchers Pronunciation Of 'Mi Gente' And Twitter Responds Accordingly,LATINO VOICES,Jenna Amatulli,2017-09-29
https://www.huffingtonpost.com/entry/watch-the-emotional-reunion-of-parents-and-their-kids-after-22-years_us_57d94726e4b0fbd4b7bc7528,Watch The Emotional Reunion Of Parents And Their Kids After 22 Years,LATINO VOICES,Nina Golgowski,2016-09-14
https://www.huffingtonpost.com/entry/trump-supporters-cleveland-deportation_us_57913b88e4b0fc06ec5c5dcd,Trump's Call For Mass Deportations Isn't Such A Big Hit With RNC Attendees,LATINO VOICES,Janie Velencia,2016-07-21
https://www.huffingtonpost.comhttp://www.nytimes.com/2015/12/20/us/politics/puetro-rico-money-debt.html?hp&action=click&pgtype=Homepage&clickSource=story-heading&module=photo-spot-region&region=top-news&WT.nav=top-news,Inside The Billion-Dollar Battle For Puerto Rico’s Future,LATINO VOICES,,2015-12-19
https://www.huffingtonpost.com/entry/reasons-humanitarian-crisis-border_n_5515651.html,These Are The Real Reasons Behind Our Humanitarian Crisis At The Border,LATINO VOICES,Roque Planas,2014-06-22
https://www.huffingtonpost.com/entry/puerto-rico-governor-congress-aid-damages-letter_us_59dcbe82e4b0208970cf973f,"Puerto Rico Governor Asks Congress For More Aid, Citing $95 Billion In Damages",LATINO VOICES,Carolina Moreno,2017-10-10
https://www.huffingtonpost.com/entry/dreamers-are-more-than-economic-statistics_us_5a1c1b8de4b0d4906cb01a83,This Is What DACA's End Means For Dreamers Like Me,LATINO VOICES,"J.J., ContributorMother, undocumented immigrant",2017-11-27
https://www.huffingtonpost.com/entry/the-breaking-cartgate-sca_b_5684500.html,The Breaking 'Cartgate' Scandal in Honduras,LATINO VOICES,"Marco Cáceres, ContributorEditor, Honduras Weekly",2014-08-16
https://www.huffingtonpost.com/entry/america-ferrera-perfectly-trumped-the-make-america-great-again-slogan_us_57bdaf4ae4b0b51733a6d3f4,Anti-Trump Shirt Inspired By America Ferrera Is The Best Political Statement,LATINO VOICES,Carolina Moreno,2016-08-24
https://www.huffingtonpost.com/entry/shakira-gets-a-kick-out-of-living-with-a-soccer-star_us_55ca340de4b0923c12be4205,Shakira Gets A 'Kick' Out Of Living With A Soccer Star,LATINO VOICES,Carolina Moreno,2015-08-11
https://www.huffingtonpost.com/entry/as-puerto-rico-begs-for-help-trump-plans-to-attend-golf-trophy-ceremony_us_59d10b46e4b06791bb1129de,"As Puerto Rico Begs For Help, Trump Plans To Attend Golf Trophy Ceremony",LATINO VOICES,Carolina Moreno,2017-10-01
https://www.huffingtonpost.com/entry/why-journalists-should-engage-with-their-readers-a_us_5939724fe4b094fa859f1651,Why Journalists Should Engage With Their Readers: A View From Slovakia,MEDIA,"The Conversation Global, ContributorThe Conversation is a collaboration between editors and academ...",2017-06-08
https://www.huffingtonpost.com/entry/journalists-unite-white-house-attacks-on-media-call-for-collective-defense_us_595d3b55e4b0615b9e8ebe91,Journalists Unite! White House Attacks On Media Call For Collective Defense,MEDIA,"Grant Glickson, ContributorPresident of the NewsGuild of New York",2017-07-05
https://www.huffingtonpost.com/entry/brian-stelter-fox-news-presidency_us_58ccc25de4b0ec9d29dc661e,CNN's Brian Stelter Slams Donald Trump For Being A 'Fox News Presidency',MEDIA,Carla Herreria,2017-03-19
https://www.huffingtonpost.com/entry/ap-robots-business-stories-associated-press_n_5543205.html,Another News Outlet Is Using Robots,MEDIA,Catherine Taibi,2014-06-30
https://www.huffingtonpost.com/entry/time--horns-hillary-clinton_n_6863338.html,OMG Did Time Put Devil Horns On Hillary Clinton?!,MEDIA,Gabriel Arana,2015-03-13
https://www.huffingtonpost.com/entry/public-relations-reporters-journalists-pay-gap_n_5671766.html,Time For Your Daily Dose Of Depressing Journalism News,MEDIA,Catherine Taibi,2014-08-12
https://www.huffingtonpost.com/entry/post-daily-news-join-forces-capital_n_6040776.html,"The End Of The NY Post, Daily News War?",MEDIA,,2014-10-24
https://www.huffingtonpost.com/entry/mika-brzezinski-minimum-wage-chris-christie_n_6041266.html,Mika Brzezinski Tears Into U.S. Minimum Wage: 'It Is A Joke!',MEDIA,Catherine Taibi,2014-10-24
https://www.huffingtonpost.com/entry/staff-of-law360-votes-to-unionize_us_57bdd066e4b0287a6e7327a7,Staff Of Law360 Votes To Unionize,MEDIA,Dave Jamieson and Alexander C. Kaufman,2016-08-24
https://www.huffingtonpost.com/entry/new-york-times-reply-all_us_57c91854e4b0e60d31dea22d,There's A One-Word Story In The New York Times Today. Read It.,MEDIA,Nick Visser,2016-09-02
https://www.huffingtonpost.com/entry/megyn-kelly-is-guilty-of-journalism_us_59434863e4b0940f84fe2d3e,Megyn Kelly Is Guilty Of Journalism,MEDIA,"Joe Raiola, ContributorSenior Editor, MAD Magazine",2017-06-19
https://www.huffingtonpost.com/entry/chris-christie-ted-cruz-rnc-speech_us_57903797e4b0bdddc4d32d29,Chris Christie Slams Ted Cruz's Speech As 'Selfish',MEDIA,Charlotte Klein,2016-07-21
https://www.huffingtonpost.com/entry/bill-oreilly-advertiser-boycott_us_58ebdf24e4b0df7e20446bb4,How Activists Destroyed Bill O’Reilly’s Reputation With Advertisers,MEDIA,Kate Abbey-Lambertz,2017-04-11
https://www.huffingtonpost.com/entry/arianna-talks-hillary-cli_b_6869864.html,WATCH: Arianna On 'Real Time With Bill Maher',MEDIA,"Huff TV, Contributor",2015-03-14
https://www.huffingtonpost.com/entry/rachel-maddow-cnn-debate-rand-paul_us_5670187de4b0e292150f22ea,Rachel Maddow Rails At 'Lying' CNN For Including Rand Paul In Debate,MEDIA,Judah Robinson,2015-12-15
https://www.huffingtonpost.com/entry/toddler-does-donuts-in-toy-corvette-video_us_55b13e84e4b08f57d5d40f8a,Toddler Does Tiny Adorable 'Donuts' In His Toy Corvette,PARENTS,Ryan Grenoble,2015-07-23
https://www.huffingtonpost.com/entry/mlb-player-shows-what-dadlife-is-all-about-with-viral-tweet_us_589d33c3e4b03df370d4f84f,MLB Player Shows What #DadLife Is All About With Viral Tweet,PARENTS,Caroline Bologna,2017-02-10
https://www.huffingtonpost.com/entry/how-to-talk-to-your-kids-about-planning-financially-for-college_us_592ed989e4b0540ffc837286,How To Talk To Your Kids About Planning Financially For College,PARENTS,"Sharon Greenthal, On Assignment For HuffPost",2017-06-01
https://www.huffingtonpost.com/entry/the-one-thing-that-would-_b_5488056.html,The One Thing That Would Help New Dads Become Better Fathers,PARENTS,"Jeff Bogle, ContributorAuthor of OutWithTheKids.com",2014-06-12
https://www.huffingtonpost.com/entry/what-happens-when-parents-treat-adults-like-toddlers_us_570512e5e4b05376618830b5,What Happens When Parents Treat Adults Like Toddlers,PARENTS,Caroline Bologna,2016-04-06
https://www.huffingtonpost.com/entry/pot-in-your-pantry-mariju_b_6004882.html,Pot In Your Pantry? Marijuana Use In Toddlers And Teens,PARENTS,"Wendy Sue Swanson, MD, MBE, FAAP, ContributorPediatrician, Advocate, Author-- Mama Doc Medicine, Seattle Ma...",2014-10-20
https://www.huffingtonpost.com/entry/because-dads-feel-it-too_us_5984be97e4b00833d1de27ba,Because Dads Feel It Too,PARENTS,"Michelle Zunter, ContributorFreelance Writer/Co-Host@The Broad's Way Podcast/Creator/Write...",2017-08-04
https://www.huffingtonpost.com/entry/the-judgmental-comments-parents-see-online-acted-out-in-real-life_us_56dd93bfe4b0ffe6f8e9e865,"The Judgmental Comments Parents See Online, Acted Out In Real Life",PARENTS,Kimberley Richards,2016-03-07
https://www.huffingtonpost.com/entry/ed-sheeran-melody-driscoll-hospital-visit_us_582c0ff1e4b0aa8910bdb6cf,Ed Sheeran Surprises 9-Year-Old Fan Who Spends Most Of Her Life In Hospital,PARENTS,Rebecca Shapiro and Caroline Bologna,2016-11-16
https://www.huffingtonpost.com/entry/video-highlights-the-kind-of-breastfeeding-shaming-we-dont-really-talk-about_us_58d285e0e4b0f838c62e4969,Video Highlights The Kind Of Breastfeeding Shaming We Don't Really Talk About,PARENTS,Caroline Bologna,2017-03-22
https://www.huffingtonpost.com/entry/too-real-video-shows-how-hard-it-is-to-make-new-mom-friends_us_596f811ee4b01696c6a20daf,Too-Real Video Shows How Hard It Is To Make New Mom Friends,PARENTS,Caroline Bologna,2017-07-19
https://www.huffingtonpost.com/entry/modern-parenting-styles_b_7482722.html,Modern Parenting Styles,PARENTS,"Jim Joseph, ContributorMarketing Master - Author - Blogger - Dad",2015-06-02
https://www.huffingtonpost.com/entry/couple-waits-9-months-to-surprise-grandma-with-pregnancy-news_us_58b48c05e4b0a8a9b7853f8d,Couple Waits 9 Months To Surprise Grandma With Pregnancy News,PARENTS,Caroline Bologna,2017-03-01
https://www.huffingtonpost.com/entry/woman-gives-birth-a-few-hours-after-walking-in-womens-march_us_5888d9abe4b098c0bba7ecae,Woman Gives Birth A Few Hours After Walking In Women's March,PARENTS,Jenna Amatulli,2017-01-25
https://www.huffingtonpost.com/entry/no-do-overs-10-ways-to-av_b_7092530.html,No Do-Overs: 10 Ways to Avoid Regret Later and Be a Better Mom Now,PARENTS,"Abby Rodman, LICSW, ContributorPsychotherapist, Author, abbyrodman.com",2015-04-18
https://www.huffingtonpost.com/entry/the-truth-about-global-warming_b_5201338.html,The Truth About Global Warming,SCIENCE,"Jeffrey Bennett, ContributorAstrophysicist, educator, and author",2014-04-25
https://www.huffingtonpost.comhttp://www.weather.com/news/science/facts-about-moon-20131011,10 Amazing Facts About The Moon - Weather.com,SCIENCE,,2013-10-13
